{
  "version": "visual-1",
  "trace_id": "trace_c2c98a38-7147-469e-b12b-0944be943511",
  "status": "executed_partial",
  "decision_traces": [
    {
      "trace_id": "trace_c2c98a38-7147-469e-b12b-0944be943511",
      "node_id": "DEC-022",
      "input": {
        "page_count": 6,
        "evidence_refs": [
          "evidence_0c422223-82da-464e-a677-e869d99f9f50",
          "evidence_cc6a5eae-dcf5-43b2-8bf1-bb477a43cf4e",
          "evidence_9147ee3b-0716-4448-b2ca-57c8441e420b",
          "evidence_71581d0b-c912-4f20-8c9f-ff4c52aff3cb",
          "evidence_79df359e-0579-44ce-ac63-d1ecfcf33422",
          "evidence_b8636bd1-e5db-44ad-8bd4-d0a4cb343209",
          "evidence_3578293b-309a-45b9-a2ea-9374f56db531",
          "evidence_46073be8-c7c5-40cb-aa36-74c1aeedebcc",
          "evidence_c23e3e67-37de-4cab-ba8a-4b75f04be93b",
          "evidence_775a7679-6d88-443e-b11f-cc217d0b0029",
          "evidence_875a7e0f-fca9-4015-bb0d-9b9b053d431c",
          "evidence_74360f33-4bde-4909-a9dd-bccb77514973",
          "evidence_880f5da3-79eb-4af3-8176-dd0ae5a2e044",
          "evidence_bee1c6ec-9cc9-4382-a518-873e0a40a6f5",
          "evidence_859cb136-cc38-4d66-8689-a4bbacbd2437",
          "evidence_11351651-9092-4e53-8317-80753e6be121",
          "evidence_cbf929a3-5497-409f-ad13-5634fd3590fb",
          "evidence_cba25ddf-0e67-4dd1-956e-6a6ac6befa9d",
          "evidence_0b6620f9-7eee-41bf-b4db-66cb75530dd6",
          "evidence_24c1535d-e21a-4e1c-8433-705afe648483",
          "evidence_79139778-c543-45cc-a4e3-8ef99986e227",
          "evidence_21f7ae90-06ee-42e2-b263-c5b2dfed584e",
          "evidence_53c39163-c1a6-48dc-8edf-d08f2e12d175",
          "evidence_ae380a5d-8cb1-43cb-8324-356df7b82a7d",
          "evidence_140f7584-586f-4c6f-a4bc-d61bc5debdb0",
          "evidence_9138d3f6-53d1-44d2-8b71-8a28f82c389a",
          "evidence_6e22c3f0-3ef7-43c7-a8c6-a42c5cadbce7",
          "evidence_10721f31-bc4c-4e4f-ae6b-e1b8deea2c09",
          "evidence_83f4a954-3f1e-4e66-bf12-2e9b9898772b",
          "evidence_acd650e8-9cc8-4991-a3c5-dfa5dc1df9fc",
          "evidence_0903cb0e-1920-4509-ab1b-f4ae69062c14",
          "evidence_7873e161-130a-4f7b-9ea5-ee3cc23840d5"
        ]
      },
      "candidates": [
        {
          "node_id": "DEC-022",
          "candidate_id": "candidate_1b675dca-a6c1-42a3-a191-2141089fc039",
          "value": {
            "page_index": 0,
            "expression": "cards_or_text",
            "kind": "text",
            "reason": "先交代数据性质与范围，避免将人工验证数据误读为真实业务数据。",
            "evidence_refs": [
              "evidence_0c422223-82da-464e-a677-e869d99f9f50",
              "evidence_cc6a5eae-dcf5-43b2-8bf1-bb477a43cf4e",
              "evidence_9147ee3b-0716-4448-b2ca-57c8441e420b",
              "evidence_71581d0b-c912-4f20-8c9f-ff4c52aff3cb",
              "evidence_79df359e-0579-44ce-ac63-d1ecfcf33422",
              "evidence_b8636bd1-e5db-44ad-8bd4-d0a4cb343209",
              "evidence_3578293b-309a-45b9-a2ea-9374f56db531",
              "evidence_46073be8-c7c5-40cb-aa36-74c1aeedebcc"
            ],
            "preserved_content": true
          },
          "score": 1,
          "reasons": [
            {
              "reason": "validated explicit structured visual choice; facts unchanged"
            }
          ],
          "evidence_refs": [
            "evidence_0c422223-82da-464e-a677-e869d99f9f50",
            "evidence_cc6a5eae-dcf5-43b2-8bf1-bb477a43cf4e",
            "evidence_9147ee3b-0716-4448-b2ca-57c8441e420b",
            "evidence_71581d0b-c912-4f20-8c9f-ff4c52aff3cb",
            "evidence_79df359e-0579-44ce-ac63-d1ecfcf33422",
            "evidence_b8636bd1-e5db-44ad-8bd4-d0a4cb343209",
            "evidence_3578293b-309a-45b9-a2ea-9374f56db531",
            "evidence_46073be8-c7c5-40cb-aa36-74c1aeedebcc",
            "evidence_c23e3e67-37de-4cab-ba8a-4b75f04be93b",
            "evidence_775a7679-6d88-443e-b11f-cc217d0b0029",
            "evidence_875a7e0f-fca9-4015-bb0d-9b9b053d431c",
            "evidence_74360f33-4bde-4909-a9dd-bccb77514973",
            "evidence_880f5da3-79eb-4af3-8176-dd0ae5a2e044",
            "evidence_bee1c6ec-9cc9-4382-a518-873e0a40a6f5",
            "evidence_859cb136-cc38-4d66-8689-a4bbacbd2437",
            "evidence_11351651-9092-4e53-8317-80753e6be121",
            "evidence_cbf929a3-5497-409f-ad13-5634fd3590fb",
            "evidence_cba25ddf-0e67-4dd1-956e-6a6ac6befa9d",
            "evidence_0b6620f9-7eee-41bf-b4db-66cb75530dd6",
            "evidence_24c1535d-e21a-4e1c-8433-705afe648483",
            "evidence_79139778-c543-45cc-a4e3-8ef99986e227",
            "evidence_21f7ae90-06ee-42e2-b263-c5b2dfed584e",
            "evidence_53c39163-c1a6-48dc-8edf-d08f2e12d175",
            "evidence_ae380a5d-8cb1-43cb-8324-356df7b82a7d",
            "evidence_140f7584-586f-4c6f-a4bc-d61bc5debdb0",
            "evidence_9138d3f6-53d1-44d2-8b71-8a28f82c389a",
            "evidence_6e22c3f0-3ef7-43c7-a8c6-a42c5cadbce7",
            "evidence_10721f31-bc4c-4e4f-ae6b-e1b8deea2c09",
            "evidence_83f4a954-3f1e-4e66-bf12-2e9b9898772b",
            "evidence_acd650e8-9cc8-4991-a3c5-dfa5dc1df9fc",
            "evidence_0903cb0e-1920-4509-ab1b-f4ae69062c14",
            "evidence_7873e161-130a-4f7b-9ea5-ee3cc23840d5"
          ],
          "constraints": [
            {
              "no_implicit_fact_inference": true,
              "no_silent_fallback": true
            }
          ]
        },
        {
          "node_id": "DEC-022",
          "candidate_id": "candidate_264c7741-fdc2-4a8c-998c-8b26cd06cf40",
          "value": {
            "page_index": 1,
            "expression": "table",
            "kind": "table",
            "reason": "调用方要求完整展示月度数据表，使用原生表格逐行保留。",
            "evidence_refs": [
              "evidence_c23e3e67-37de-4cab-ba8a-4b75f04be93b",
              "evidence_775a7679-6d88-443e-b11f-cc217d0b0029",
              "evidence_875a7e0f-fca9-4015-bb0d-9b9b053d431c",
              "evidence_74360f33-4bde-4909-a9dd-bccb77514973",
              "evidence_880f5da3-79eb-4af3-8176-dd0ae5a2e044",
              "evidence_bee1c6ec-9cc9-4382-a518-873e0a40a6f5",
              "evidence_859cb136-cc38-4d66-8689-a4bbacbd2437",
              "evidence_0c422223-82da-464e-a677-e869d99f9f50",
              "evidence_11351651-9092-4e53-8317-80753e6be121",
              "evidence_cbf929a3-5497-409f-ad13-5634fd3590fb",
              "evidence_cba25ddf-0e67-4dd1-956e-6a6ac6befa9d",
              "evidence_cc6a5eae-dcf5-43b2-8bf1-bb477a43cf4e",
              "evidence_0b6620f9-7eee-41bf-b4db-66cb75530dd6",
              "evidence_24c1535d-e21a-4e1c-8433-705afe648483",
              "evidence_79139778-c543-45cc-a4e3-8ef99986e227",
              "evidence_9147ee3b-0716-4448-b2ca-57c8441e420b",
              "evidence_21f7ae90-06ee-42e2-b263-c5b2dfed584e",
              "evidence_53c39163-c1a6-48dc-8edf-d08f2e12d175",
              "evidence_71581d0b-c912-4f20-8c9f-ff4c52aff3cb",
              "evidence_46073be8-c7c5-40cb-aa36-74c1aeedebcc"
            ],
            "preserved_content": true
          },
          "score": 1,
          "reasons": [
            {
              "reason": "validated explicit structured visual choice; facts unchanged"
            }
          ],
          "evidence_refs": [
            "evidence_0c422223-82da-464e-a677-e869d99f9f50",
            "evidence_cc6a5eae-dcf5-43b2-8bf1-bb477a43cf4e",
            "evidence_9147ee3b-0716-4448-b2ca-57c8441e420b",
            "evidence_71581d0b-c912-4f20-8c9f-ff4c52aff3cb",
            "evidence_79df359e-0579-44ce-ac63-d1ecfcf33422",
            "evidence_b8636bd1-e5db-44ad-8bd4-d0a4cb343209",
            "evidence_3578293b-309a-45b9-a2ea-9374f56db531",
            "evidence_46073be8-c7c5-40cb-aa36-74c1aeedebcc",
            "evidence_c23e3e67-37de-4cab-ba8a-4b75f04be93b",
            "evidence_775a7679-6d88-443e-b11f-cc217d0b0029",
            "evidence_875a7e0f-fca9-4015-bb0d-9b9b053d431c",
            "evidence_74360f33-4bde-4909-a9dd-bccb77514973",
            "evidence_880f5da3-79eb-4af3-8176-dd0ae5a2e044",
            "evidence_bee1c6ec-9cc9-4382-a518-873e0a40a6f5",
            "evidence_859cb136-cc38-4d66-8689-a4bbacbd2437",
            "evidence_11351651-9092-4e53-8317-80753e6be121",
            "evidence_cbf929a3-5497-409f-ad13-5634fd3590fb",
            "evidence_cba25ddf-0e67-4dd1-956e-6a6ac6befa9d",
            "evidence_0b6620f9-7eee-41bf-b4db-66cb75530dd6",
            "evidence_24c1535d-e21a-4e1c-8433-705afe648483",
            "evidence_79139778-c543-45cc-a4e3-8ef99986e227",
            "evidence_21f7ae90-06ee-42e2-b263-c5b2dfed584e",
            "evidence_53c39163-c1a6-48dc-8edf-d08f2e12d175",
            "evidence_ae380a5d-8cb1-43cb-8324-356df7b82a7d",
            "evidence_140f7584-586f-4c6f-a4bc-d61bc5debdb0",
            "evidence_9138d3f6-53d1-44d2-8b71-8a28f82c389a",
            "evidence_6e22c3f0-3ef7-43c7-a8c6-a42c5cadbce7",
            "evidence_10721f31-bc4c-4e4f-ae6b-e1b8deea2c09",
            "evidence_83f4a954-3f1e-4e66-bf12-2e9b9898772b",
            "evidence_acd650e8-9cc8-4991-a3c5-dfa5dc1df9fc",
            "evidence_0903cb0e-1920-4509-ab1b-f4ae69062c14",
            "evidence_7873e161-130a-4f7b-9ea5-ee3cc23840d5"
          ],
          "constraints": [
            {
              "no_implicit_fact_inference": true,
              "no_silent_fallback": true
            }
          ]
        },
        {
          "node_id": "DEC-022",
          "candidate_id": "candidate_d804188f-1640-491d-8c0e-1de6bf20ca48",
          "value": {
            "page_index": 2,
            "expression": "chart",
            "kind": "chart",
            "reason": "调用方要求图表且不同单位不得混在同一数值轴，故仅绘制用电量系列。",
            "evidence_refs": [
              "evidence_bee1c6ec-9cc9-4382-a518-873e0a40a6f5",
              "evidence_cbf929a3-5497-409f-ad13-5634fd3590fb",
              "evidence_24c1535d-e21a-4e1c-8433-705afe648483",